{
  "schema_version": "0.3.0",
  "dataset_id": "review-synthetic-v1",
  "description": "Authored synthetic review records; incomplete scenario, not a complete replay or data service.",
  "sources": [
    {
      "source_id": "source-synthetic-v1",
      "title": "Matchmate authored review examples",
      "origin": "synthetic_authoring",
      "locator": "wiki/DATA-SCENARIO.md",
      "retrieved_at": "2026-10-15T00:00:00Z",
      "usage": "synthetic_project_example"
    }
  ],
  "records": [
    {
      "record_id": "club-harbour",
      "revision_id": "club-harbour-v1",
      "supersedes_revision_id": null,
      "kind": "club",
      "source_id": "source-synthetic-v1",
      "provenance": "synthetic",
      "claim_status": "authored",
      "valid_from": "2025-01-01T00:00:00Z",
      "valid_to": null,
      "recorded_at": "2026-10-15T00:00:00Z",
      "published_at": null,
      "synthetic_released_at": "2025-01-01T00:00:00Z",
      "payload": {
        "name": "Harbour FC",
        "aliases": [],
        "location": null
      }
    },
    {
      "record_id": "club-riverside",
      "revision_id": "club-riverside-v1",
      "supersedes_revision_id": null,
      "kind": "club",
      "source_id": "source-synthetic-v1",
      "provenance": "synthetic",
      "claim_status": "authored",
      "valid_from": "2025-01-01T00:00:00Z",
      "valid_to": null,
      "recorded_at": "2026-10-15T00:00:00Z",
      "published_at": null,
      "synthetic_released_at": "2025-01-01T00:00:00Z",
      "payload": {
        "name": "Riverside FC",
        "aliases": [],
        "location": null
      }
    },
    {
      "record_id": "player-h6",
      "revision_id": "player-h6-v1",
      "supersedes_revision_id": null,
      "kind": "person",
      "source_id": "source-synthetic-v1",
      "provenance": "synthetic",
      "claim_status": "authored",
      "valid_from": "2025-01-01T00:00:00Z",
      "valid_to": null,
      "recorded_at": "2026-10-15T00:00:00Z",
      "published_at": null,
      "synthetic_released_at": "2025-01-01T00:00:00Z",
      "payload": {
        "name": "Alex Reed",
        "aliases": [],
        "birth_date": "2000-03-01"
      }
    },
    {
      "record_id": "player-h7",
      "revision_id": "player-h7-v1",
      "supersedes_revision_id": null,
      "kind": "person",
      "source_id": "source-synthetic-v1",
      "provenance": "synthetic",
      "claim_status": "authored",
      "valid_from": "2025-01-01T00:00:00Z",
      "valid_to": null,
      "recorded_at": "2026-10-15T00:00:00Z",
      "published_at": null,
      "synthetic_released_at": "2025-01-01T00:00:00Z",
      "payload": {
        "name": "Morgan Lane",
        "aliases": [],
        "birth_date": null
      }
    },
    {
      "record_id": "player-h8",
      "revision_id": "player-h8-v1",
      "supersedes_revision_id": null,
      "kind": "person",
      "source_id": "source-synthetic-v1",
      "provenance": "synthetic",
      "claim_status": "authored",
      "valid_from": "2025-01-01T00:00:00Z",
      "valid_to": null,
      "recorded_at": "2026-10-15T00:00:00Z",
      "published_at": null,
      "synthetic_released_at": "2025-01-01T00:00:00Z",
      "payload": {
        "name": "Jamie Vale",
        "aliases": [],
        "birth_date": null
      }
    },
    {
      "record_id": "player-h18",
      "revision_id": "player-h18-v1",
      "supersedes_revision_id": null,
      "kind": "person",
      "source_id": "source-synthetic-v1",
      "provenance": "synthetic",
      "claim_status": "authored",
      "valid_from": "2025-01-01T00:00:00Z",
      "valid_to": null,
      "recorded_at": "2026-10-15T00:00:00Z",
      "published_at": null,
      "synthetic_released_at": "2025-01-01T00:00:00Z",
      "payload": {
        "name": "Sam Park",
        "aliases": [],
        "birth_date": null
      }
    },
    {
      "record_id": "player-r4",
      "revision_id": "player-r4-v1",
      "supersedes_revision_id": null,
      "kind": "person",
      "source_id": "source-synthetic-v1",
      "provenance": "synthetic",
      "claim_status": "authored",
      "valid_from": "2025-01-01T00:00:00Z",
      "valid_to": null,
      "recorded_at": "2026-10-15T00:00:00Z",
      "published_at": null,
      "synthetic_released_at": "2025-01-01T00:00:00Z",
      "payload": {
        "name": "Taylor Brook",
        "aliases": [],
        "birth_date": null
      }
    },
    {
      "record_id": "coach-h1",
      "revision_id": "coach-h1-v1",
      "supersedes_revision_id": null,
      "kind": "person",
      "source_id": "source-synthetic-v1",
      "provenance": "synthetic",
      "claim_status": "authored",
      "valid_from": "2025-01-01T00:00:00Z",
      "valid_to": null,
      "recorded_at": "2026-10-15T00:00:00Z",
      "published_at": null,
      "synthetic_released_at": "2025-01-01T00:00:00Z",
      "payload": {
        "name": "Robin Ellis",
        "aliases": [],
        "birth_date": null
      }
    },
    {
      "record_id": "coach-h2",
      "revision_id": "coach-h2-v1",
      "supersedes_revision_id": null,
      "kind": "person",
      "source_id": "source-synthetic-v1",
      "provenance": "synthetic",
      "claim_status": "authored",
      "valid_from": "2025-01-01T00:00:00Z",
      "valid_to": null,
      "recorded_at": "2026-10-15T00:00:00Z",
      "published_at": null,
      "synthetic_released_at": "2025-01-01T00:00:00Z",
      "payload": {
        "name": "Casey West",
        "aliases": [],
        "birth_date": null
      }
    },
    {
      "record_id": "official-r1",
      "revision_id": "official-r1-v1",
      "supersedes_revision_id": null,
      "kind": "person",
      "source_id": "source-synthetic-v1",
      "provenance": "synthetic",
      "claim_status": "authored",
      "valid_from": "2025-01-01T00:00:00Z",
      "valid_to": null,
      "recorded_at": "2026-10-15T00:00:00Z",
      "published_at": null,
      "synthetic_released_at": "2025-01-01T00:00:00Z",
      "payload": {
        "name": "Mira Vale",
        "aliases": [],
        "birth_date": null
      }
    },
    {
      "record_id": "affiliation-h6-harbour",
      "revision_id": "affiliation-h6-harbour-v1",
      "supersedes_revision_id": null,
      "kind": "affiliation",
      "source_id": "source-synthetic-v1",
      "provenance": "synthetic",
      "claim_status": "authored",
      "valid_from": "2025-01-01T00:00:00Z",
      "valid_to": null,
      "recorded_at": "2026-10-15T00:00:00Z",
      "published_at": null,
      "synthetic_released_at": "2025-01-01T00:00:00Z",
      "payload": {
        "person_id": "player-h6",
        "club_id": "club-harbour",
        "role": "player",
        "appointment_type": "permanent",
        "shirt_number": 6
      }
    },
    {
      "record_id": "affiliation-h6-harbour",
      "revision_id": "affiliation-h6-harbour-v2",
      "supersedes_revision_id": "affiliation-h6-harbour-v1",
      "kind": "affiliation",
      "source_id": "source-synthetic-v1",
      "provenance": "synthetic",
      "claim_status": "authored",
      "valid_from": "2025-01-01T00:00:00Z",
      "valid_to": "2026-07-01T00:00:00Z",
      "recorded_at": "2026-10-15T00:00:00Z",
      "published_at": null,
      "synthetic_released_at": "2026-06-15T00:00:00Z",
      "payload": {
        "person_id": "player-h6",
        "club_id": "club-harbour",
        "role": "player",
        "appointment_type": "permanent",
        "shirt_number": 6
      }
    },
    {
      "record_id": "affiliation-h6-riverside",
      "revision_id": "affiliation-h6-riverside-v1",
      "supersedes_revision_id": null,
      "kind": "affiliation",
      "source_id": "source-synthetic-v1",
      "provenance": "synthetic",
      "claim_status": "authored",
      "valid_from": "2026-07-01T00:00:00Z",
      "valid_to": null,
      "recorded_at": "2026-10-15T00:00:00Z",
      "published_at": null,
      "synthetic_released_at": "2026-06-15T00:00:00Z",
      "payload": {
        "person_id": "player-h6",
        "club_id": "club-riverside",
        "role": "player",
        "appointment_type": "permanent",
        "shirt_number": null
      }
    },
    {
      "record_id": "profile-h6",
      "revision_id": "profile-h6-v1",
      "supersedes_revision_id": null,
      "kind": "player_profile",
      "source_id": "source-synthetic-v1",
      "provenance": "synthetic",
      "claim_status": "authored",
      "valid_from": "2025-01-01T00:00:00Z",
      "valid_to": null,
      "recorded_at": "2026-10-15T00:00:00Z",
      "published_at": null,
      "synthetic_released_at": "2025-01-01T00:00:00Z",
      "payload": {
        "person_id": "player-h6",
        "preferred_foot": "right",
        "positions": [
          "central_midfielder"
        ]
      }
    },
    {
      "record_id": "appointment-h1",
      "revision_id": "appointment-h1-v1",
      "supersedes_revision_id": null,
      "kind": "affiliation",
      "source_id": "source-synthetic-v1",
      "provenance": "synthetic",
      "claim_status": "authored",
      "valid_from": "2025-01-01T00:00:00Z",
      "valid_to": null,
      "recorded_at": "2026-10-15T00:00:00Z",
      "published_at": null,
      "synthetic_released_at": "2025-01-01T00:00:00Z",
      "payload": {
        "person_id": "coach-h1",
        "club_id": "club-harbour",
        "role": "head_coach",
        "appointment_type": "permanent",
        "shirt_number": null
      }
    },
    {
      "record_id": "stadium-lantern",
      "revision_id": "stadium-lantern-v1",
      "supersedes_revision_id": null,
      "kind": "stadium",
      "source_id": "source-synthetic-v1",
      "provenance": "synthetic",
      "claim_status": "authored",